{
  "build_provenance": {
    "built_at": "2026-05-23T08:01:59Z"
  },
  "cds_code": "36-67678-6035588",
  "charter": false,
  "county": "San Bernardino",
  "data_sources_used": [
    "cde_spedps",
    "cde_enrollment",
    "ca_dashboard"
  ],
  "district_cds": "36-67678",
  "district_name": "Chino Valley Unified",
  "enrollment": {
    "pct_iep": {
      "as_of": "2024-10-02",
      "note": "Derived: all students with disabilities as a share of total school enrollment. School-level data has no autism breakdown \u2014 autism figures are district-level only.",
      "source": "derived",
      "value": 0.1511
    },
    "students_with_iep": {
      "as_of": "2024-10-02",
      "fetched_at": "2026-05-23T08:01:59Z",
      "source": "cde_spedps",
      "url": "https://www.cde.ca.gov/ds/ad/filesspedps.asp",
      "value": 73
    },
    "total": {
      "as_of": "2024-10-02",
      "fetched_at": "2026-05-23T08:01:59Z",
      "source": "cde_enrollment",
      "url": "https://www.cde.ca.gov/ds/ad/filesenrcensus.asp",
      "value": 483
    }
  },
  "inclusion_metrics": {
    "lre_80pct_plus_gen_ed_all_disabilities": {
      "as_of": "2024-10-02",
      "fetched_at": "2026-05-23T08:01:59Z",
      "source": "cde_spedps",
      "url": "https://www.cde.ca.gov/ds/ad/filesspedps.asp",
      "value": 0.699
    },
    "lre_separate_setting_all_disabilities": {
      "as_of": "2024-10-02",
      "fetched_at": "2026-05-23T08:01:59Z",
      "source": "cde_spedps",
      "url": "https://www.cde.ca.gov/ds/ad/filesspedps.asp",
      "value": 0.041
    }
  },
  "last_updated": "2026-05-23",
  "level": "school",
  "name": "Walnut Avenue Elementary",
  "outcome_metrics": {
    "chronic_absenteeism_rate_all": {
      "as_of": "2025-06-30",
      "fetched_at": "2026-05-23T08:01:59Z",
      "source": "ca_dashboard",
      "url": "https://www.cde.ca.gov/ta/ac/cm/dashboardresources.asp",
      "value": 0.307
    },
    "chronic_absenteeism_rate_swd": {
      "as_of": "2025-06-30",
      "fetched_at": "2026-05-23T08:01:59Z",
      "source": "ca_dashboard",
      "url": "https://www.cde.ca.gov/ta/ac/cm/dashboardresources.asp",
      "value": 0.384
    },
    "ela_distance_from_standard_all": {
      "as_of": "2025-06-30",
      "fetched_at": "2026-05-23T08:01:59Z",
      "source": "ca_dashboard",
      "url": "https://www.cde.ca.gov/ta/ac/cm/dashboardresources.asp",
      "value": -45.3
    },
    "ela_distance_from_standard_swd": {
      "as_of": "2025-06-30",
      "fetched_at": "2026-05-23T08:01:59Z",
      "source": "ca_dashboard",
      "url": "https://www.cde.ca.gov/ta/ac/cm/dashboardresources.asp",
      "value": -157.9
    },
    "math_distance_from_standard_all": {
      "as_of": "2025-06-30",
      "fetched_at": "2026-05-23T08:01:59Z",
      "source": "ca_dashboard",
      "url": "https://www.cde.ca.gov/ta/ac/cm/dashboardresources.asp",
      "value": -76.7
    },
    "math_distance_from_standard_swd": {
      "as_of": "2025-06-30",
      "fetched_at": "2026-05-23T08:01:59Z",
      "source": "ca_dashboard",
      "url": "https://www.cde.ca.gov/ta/ac/cm/dashboardresources.asp",
      "value": -164.8
    },
    "suspension_rate_all": {
      "as_of": "2025-06-30",
      "fetched_at": "2026-05-23T08:01:59Z",
      "source": "ca_dashboard",
      "url": "https://www.cde.ca.gov/ta/ac/cm/dashboardresources.asp",
      "value": 0.009
    },
    "suspension_rate_swd": {
      "as_of": "2025-06-30",
      "fetched_at": "2026-05-23T08:01:59Z",
      "source": "ca_dashboard",
      "url": "https://www.cde.ca.gov/ta/ac/cm/dashboardresources.asp",
      "value": 0.022
    }
  },
  "schema_version": "0.1.0",
  "school_code": "6035588"
}