{
  "build_provenance": {
    "built_at": "2026-05-23T08:01:59Z"
  },
  "cds_code": "19-64568-1933472",
  "charter": false,
  "county": "Los Angeles",
  "data_sources_used": [
    "cde_spedps",
    "cde_enrollment",
    "ca_dashboard"
  ],
  "district_cds": "19-64568",
  "district_name": "Glendale Unified",
  "enrollment": {
    "pct_iep": {
      "as_of": "2024-10-02",
      "note": "Derived: all students with disabilities as a share of total school enrollment. School-level data has no autism breakdown \u2014 autism figures are district-level only.",
      "source": "derived",
      "value": 0.1528
    },
    "students_with_iep": {
      "as_of": "2024-10-02",
      "fetched_at": "2026-05-23T08:01:59Z",
      "source": "cde_spedps",
      "url": "https://www.cde.ca.gov/ds/ad/filesspedps.asp",
      "value": 11
    },
    "total": {
      "as_of": "2024-10-02",
      "fetched_at": "2026-05-23T08:01:59Z",
      "source": "cde_enrollment",
      "url": "https://www.cde.ca.gov/ds/ad/filesenrcensus.asp",
      "value": 72
    }
  },
  "inclusion_metrics": {
    "lre_80pct_plus_gen_ed_all_disabilities": {
      "as_of": "2024-10-02",
      "fetched_at": "2026-05-23T08:01:59Z",
      "source": "cde_spedps",
      "url": "https://www.cde.ca.gov/ds/ad/filesspedps.asp",
      "value": 0.455
    },
    "lre_separate_setting_all_disabilities": {
      "as_of": "2024-10-02",
      "fetched_at": "2026-05-23T08:01:59Z",
      "source": "cde_spedps",
      "url": "https://www.cde.ca.gov/ds/ad/filesspedps.asp",
      "value": 0.0
    }
  },
  "last_updated": "2026-05-23",
  "level": "school",
  "name": "Daily (Allan F.) High (Continuation)",
  "outcome_metrics": {
    "ela_distance_from_standard_all": {
      "as_of": "2025-06-30",
      "fetched_at": "2026-05-23T08:01:59Z",
      "source": "ca_dashboard",
      "url": "https://www.cde.ca.gov/ta/ac/cm/dashboardresources.asp",
      "value": -161.4
    },
    "ela_distance_from_standard_swd": {
      "as_of": "2025-06-30",
      "fetched_at": "2026-05-23T08:01:59Z",
      "source": "ca_dashboard",
      "url": "https://www.cde.ca.gov/ta/ac/cm/dashboardresources.asp",
      "value": null
    },
    "math_distance_from_standard_all": {
      "as_of": "2025-06-30",
      "fetched_at": "2026-05-23T08:01:59Z",
      "source": "ca_dashboard",
      "url": "https://www.cde.ca.gov/ta/ac/cm/dashboardresources.asp",
      "value": -210.3
    },
    "math_distance_from_standard_swd": {
      "as_of": "2025-06-30",
      "fetched_at": "2026-05-23T08:01:59Z",
      "source": "ca_dashboard",
      "url": "https://www.cde.ca.gov/ta/ac/cm/dashboardresources.asp",
      "value": null
    },
    "suspension_rate_all": {
      "as_of": "2025-06-30",
      "fetched_at": "2026-05-23T08:01:59Z",
      "source": "ca_dashboard",
      "url": "https://www.cde.ca.gov/ta/ac/cm/dashboardresources.asp",
      "value": 0.11
    },
    "suspension_rate_swd": {
      "as_of": "2025-06-30",
      "fetched_at": "2026-05-23T08:01:59Z",
      "source": "ca_dashboard",
      "url": "https://www.cde.ca.gov/ta/ac/cm/dashboardresources.asp",
      "value": 0.13
    }
  },
  "schema_version": "0.1.0",
  "school_code": "1933472"
}